"id","name","description","start_date"
"1","PwC Challenge","Create in 7 days a layered FastAPI REST API.","2025-01-29 19:22:21.189137+00"
"12","Mobile App Development","Development of a mobile app for task management.","2025-02-01 09:00:00+00"
"13","E-learning Platform","Creation of an online learning platform.","2025-10-05 10:00:00+00"
"14","Inventory Management System","Development of a real-time inventory management system.","2025-03-10 11:00:00+00"
"15","Digital Marketing Campaign","Digital marketing campaign for a new product launch.","2025-04-15 12:00:00+00"
"16","Sales Process Automation","Automation of sales processes using AI.","2025-05-20 13:00:00+00"